{
  "agent_id": "claude-contract-gen",
  "attempt_id": "ATT-001",
  "task_type": "task_contract_generation",
  "run_id": "RUN-20260606-001",
  "prompt": "Generate a task contract for: Add input validation to the config parser module.",
  "output_schema": "task_contract",
  "created_at": "2026-06-06T12:00:00Z",
  "redaction_count": 0
}
